Fr,article,EN,Example_FR,Example_EN,TAGS
"Ce que je dis, c’est que",,what I’m saying is that,"Ce Ce que je dis, c’est que sera communiqué aux parties prenantes.",This what I’m saying is that will be communicated to stakeholders.,F9 — Insistance
Encore une fois,,once again,Cet Encore une fois sera communiqué aux parties prenantes.,This once again will be communicated to stakeholders.,F9 — Insistance
Parce que,,because,Ce Parce que sera communiqué aux parties prenantes.,This because will be communicated to stakeholders.,F10 — Cause et conséquence
Étant donné,,given (that),Cet Étant donné sera communiqué aux parties prenantes.,This given (that) will be communicated to stakeholders.,F10 — Cause et conséquence
Comme,,as; since,Ce Comme sera communiqué aux parties prenantes.,This as; since will be communicated to stakeholders.,F10 — Cause et conséquence
Vu,,in view of; given,Ce Vu sera communiqué aux parties prenantes.,This in view of; given will be communicated to stakeholders.,F10 — Cause et conséquence
À cause de,,because of,Cet À cause de sera communiqué aux parties prenantes.,This because of will be communicated to stakeholders.,F10 — Cause et conséquence
Grâce à,,thanks to,Ce Grâce à sera communiqué aux parties prenantes.,This thanks to will be communicated to stakeholders.,F10 — Cause et conséquence
C’est que,,it’s because,Ce C’est que sera communiqué aux parties prenantes.,This it’s because will be communicated to stakeholders.,F10 — Cause et conséquence
À force de,,by dint of; from (doing something repeatedly),Cet À force de sera communiqué aux parties prenantes.,This by dint of; from (doing something repeatedly) will be communicated to stakeholders.,F10 — Cause et conséquence
"des raisons, c’est que",une,one of the reasons is that,"Ce des raisons, c’est que sera communiqué aux parties prenantes.",This one of the reasons is that will be communicated to stakeholders.,F10 — Cause et conséquence
"Ce qui explique ça, c’est",,what explains that is,"Ce Ce qui explique ça, c’est sera communiqué aux parties prenantes.",This what explains that is will be communicated to stakeholders.,F10 — Cause et conséquence
Donc,,so; therefore,Ce Donc sera communiqué aux parties prenantes.,This so; therefore will be communicated to stakeholders.,F10 — Cause et conséquence
Alors,,then; so,Cet Alors sera communiqué aux parties prenantes.,This then; so will be communicated to stakeholders.,F10 — Cause et conséquence
Par conséquent,,consequently,Ce Par conséquent sera communiqué aux parties prenantes.,This consequently will be communicated to stakeholders.,F10 — Cause et conséquence
Ce qui fait que,,which means that; so that,Ce Ce qui fait que sera communiqué aux parties prenantes.,This which means that; so that will be communicated to stakeholders.,F10 — Cause et conséquence
Ça pourrait causer,,that could cause,Ce Ça pourrait causer sera communiqué aux parties prenantes.,that could cause will be communicated to stakeholders.,F10 — Cause et conséquence
"Ce qui est arrivé, c’est que",,what happened is that,"Ce Ce qui est arrivé, c’est que sera communiqué aux parties prenantes.",This what happened is that will be communicated to stakeholders.,F10 — Cause et conséquence
Ça a permis de,,that made it possible to,Ce Ça a permis de sera communiqué aux parties prenantes.,that made it possible to will be communicated to stakeholders.,F10 — Cause et conséquence
Ce qui nous a amenés à,,which led us to,Ce Ce qui nous a amenés à sera communiqué aux parties prenantes.,This which led us to will be communicated to stakeholders.,F10 — Cause et conséquence
Tellement (...) que,,so ... that,Ce Tellement (...) que sera communiqué aux parties prenantes.,This so ... that will be communicated to stakeholders.,F10 — Cause et conséquence
C’est pour ça que,,that’s why,Ce C’est pour ça que sera communiqué aux parties prenantes.,This that’s why will be communicated to stakeholders.,F10 — Cause et conséquence
C’est à cause de ça que,,it’s because of that that,Ce C’est à cause de ça que sera communiqué aux parties prenantes.,This it’s because of that that will be communicated to stakeholders.,F10 — Cause et conséquence
C’est ce qui explique,,that’s what explains,Ce C’est ce qui explique sera communiqué aux parties prenantes.,This that’s what explains will be communicated to stakeholders.,F10 — Cause et conséquence
C’est pour cette raison que,,for this reason,Ce C’est pour cette raison que sera communiqué aux parties prenantes.,This for this reason will be communicated to stakeholders.,F10 — Cause et conséquence
C’est la raison pour laquelle,,that’s the reason why,Ce C’est la raison pour laquelle sera communiqué aux parties prenantes.,This that’s the reason why will be communicated to stakeholders.,F10 — Cause et conséquence
En gros (ce que je veux dire),,basically (what I mean),Cet En gros (ce que je veux dire) sera communiqué aux parties prenantes.,This basically (what I mean) will be communicated to stakeholders.,F11 — Résumé
En un mot,,in a word,Cet En un mot sera communiqué aux parties prenantes.,This in a word will be communicated to stakeholders.,F11 — Résumé
En fait,,in fact; actually (FR usage),Cet En fait sera communiqué aux parties prenantes.,This in fact; actually (FR usage) will be communicated to stakeholders.,F11 — Résumé
Tout ça pour dire que,,all this to say that,Ce Tout ça pour dire que sera communiqué aux parties prenantes.,This all this to say that will be communicated to stakeholders.,F11 — Résumé
Pour résumer,,to summarize,Veuillez Pour résumer le formulaire d'ici vendredi.,Please summarize the document by Friday.,F11 — Résumé
En résumé,,in summary,Cet En résumé sera communiqué aux parties prenantes.,This in summary will be communicated to stakeholders.,F11 — Résumé
Grosso modo,,roughly; broadly speaking,Ce Grosso modo sera communiqué aux parties prenantes.,This roughly; broadly speaking will be communicated to stakeholders.,F11 — Résumé
Bref,,in short,Ce Bref sera communiqué aux parties prenantes.,This in short will be communicated to stakeholders.,F11 — Résumé
Tout compte fait,,all things considered,Ce Tout compte fait sera communiqué aux parties prenantes.,This all things considered will be communicated to stakeholders.,F11 — Résumé
En somme,,in sum,Cet En somme sera communiqué aux parties prenantes.,This in sum will be communicated to stakeholders.,F11 — Résumé
Pour tout dire,,to tell the truth; frankly,Veuillez Pour tout dire la pièce jointe d'ici vendredi.,Please tell the truth; frankly the document by Friday.,F11 — Résumé
